id,req_id,category,formalized_text,feature_group,original_text,assumptions,constraints,dependencies,detail_analysis,priority,validation_criteria
1913,REQ-CSVC-001,Functional,"The OPC client library/service shall support communication using OPC Data Access (DA) versions 2.05a and 3.0, OPC Unified Architecture (UA) version 1.04 and higher (including relevant companion specifications as applicable), and OPC XML-DA version 1.01 for real-time data exchange. The client shall handle diverse data types and structures as defined by these standards.",Core OPC Client Services,"Supports OPC DA (versions 2.05a and 3.0), OPC UA (version 1.04 and higher, including relevant companion specifications as applicable), and OPC XML-DA (version 1.01), handling diverse data types and structures. Ensures compatibility with servers from manufacturers like Siemens or Rockwell.",,,,FALSE,high,
1914,REQ-CSVC-002,Functional,"The OPC client library/service shall provide functionality to browse the address space (namespace) of connected OPC DA and OPC UA servers, enabling discovery of available tags and server structure.",Core OPC Client Services,Allows users to browse server namespaces...,,,,FALSE,high,
1915,REQ-CSVC-003,Functional,"The OPC client library/service shall enable applications to read the current values, timestamps, and quality of specified tags from connected OPC DA and OPC UA servers.",Core OPC Client Services,...read current tag values...,,,,FALSE,high,
1916,REQ-CSVC-004,Functional,The OPC client library/service shall enable applications to write values to specified tags on connected OPC DA and OPC UA servers.,Core OPC Client Services,...and write updates.,,,,FALSE,high,
1917,REQ-CSVC-005,NonFunctional,The OPC client library/service shall achieve a P99 latency of less than 50ms for typical synchronous read and write operations to OPC servers under defined load conditions.,Core OPC Client Services,"Ensures low-latency communication for time-critical applications, with target read/write latency of less than 50ms (P99) for typical operations.",,,,FALSE,high,
1918,REQ-CSVC-006,Functional,"The OPC client library/service shall implement robust error handling for read and write operations, providing clear status codes and descriptive messages to the calling application for failures such as communication timeouts, connection loss, invalid tag addresses, or access denied.",Core OPC Client Services,"Error handling for failed read/write operations (e.g., communication timeouts, connection loss, invalid tag address) will be implemented, providing clear status codes and messages to the calling application or UI.",,,,FALSE,high,
1919,REQ-CSVC-007,Functional,"The OPC client library/service shall support configurable client-side data validation rules (e.g., range checks, data type checks) for write operations before sending data to the OPC server. The system shall provide feedback if validation fails.",Core OPC Client Services,"Data validation rules for write operations (e.g., range checks, type checks if configurable by user) will be supported.",,,,FALSE,medium,
1920,REQ-CSVC-008,Functional,"The system shall provide a mechanism to import tag configurations (including tag lists, server addresses, item IDs, and scaling parameters) from common file formats (e.g., CSV, XML). The system shall validate imported configurations for correctness and completeness.",Core OPC Client Services,"A mechanism for importing existing tag configurations (e.g., tag lists, addresses, scaling parameters) from common legacy OPC client formats or spreadsheets will be provided to expedite setup. Validation of imported configurations will be performed.",,,,FALSE,medium,
1921,REQ-CSVC-009,Functional,"The system shall log all write operations to designated critical control system tags. Each log entry must include user credentials (if available from the calling context), timestamp of the operation, the tag identifier, the old value (if retrievable), and the new value written. This logging must support audit trail requirements for regulations like FDA 21 CFR Part 11.",Core OPC Client Services,"All write operations to critical control system tags must be logged with user credentials, timestamp, old value, and new value for audit trail purposes, in compliance with relevant industry regulations (e.g., FDA 21 CFR Part 11 for pharmaceutical applications).",,,,FALSE,high,
1922,REQ-CSVC-010,Functional,"The system shall support configurable limits on data write operations, including rate limits (number of writes per unit of time to a tag/server) and value change thresholds that may require secondary confirmation before the write is executed. These limits shall be configurable based on organizational policies.",Core OPC Client Services,"Configurable limits on data write operations (e.g., rate limits, value change thresholds requiring secondary confirmation) may be implemented based on organizational safety and operational policies.",,,,FALSE,medium,
1923,REQ-CSVC-011,Functional,The OPC client library/service shall implement the OPC Historical Data Access (HDA) specification to retrieve historical data from compliant OPC HDA servers. This includes supporting queries for processed or raw data over specified time ranges.,Core OPC Client Services,"Implements the OPC Historical Access specification, supporting queries over specific time ranges.",,,,FALSE,high,
1924,REQ-CSVC-012,Functional,"The OPC client library/service, when querying OPC HDA servers, shall support requesting various data aggregation functions as defined by the OPC HDA specification. Supported functions must include average, minimum, maximum, count, range, total, and standard interpolation types (e.g., linear, stepped). The service shall also support filtering criteria as per OPC HDA for historical data queries.",Core OPC Client Services,"Includes data aggregation, filtering, and trend visualization tools. Supported data aggregation functions will include, but are not limited to, average, minimum, maximum, count, range, total, and various interpolation types (e.g., linear, stepped).",,,,FALSE,high,
1925,REQ-CSVC-013,Functional,"The OPC client system shall be capable of providing retrieved historical data (conforming to a defined model: timestamp, tag identifier, value, quality, metadata) for ingestion into a designated time-series database. This data provision shall support optimized batching or streaming and include configurable validation rules (e.g., timestamp sanity checks, value range checks) before data is passed for ingestion.",Core OPC Client Services,Historical data and alarm/event logs will be stored in a suitable time-series database... Data ingestion into the time-series database will be handled via optimized batching mechanisms or streaming connectors... with configurable data validation rules...,,,,FALSE,high,
1926,REQ-CSVC-014,NonFunctional,"The OPC client library/service, when interacting with an OPC HDA server, shall facilitate historical data queries such that retrieving a 1-day time range of data for 100 tags completes in less than 2 seconds (P95), assuming adequate OPC HDA server and network performance.",Core OPC Client Services,"Query response times for a 1-day range of 100 tags should be less than 2 seconds, utilizing native query languages like Flux for InfluxDB or SQL for TimescaleDB.",,,,FALSE,high,
1927,REQ-CSVC-015,Functional,"The OPC client library/service shall implement error handling for OPC HDA queries, providing clear status codes and descriptive messages to the calling application for failures such as data not found for the specified range, query timeout, or invalid aggregation parameters.",Core OPC Client Services,"Error handling for HDA queries (e.g., data not found for the specified range, query timeout, invalid aggregation parameters) will provide informative feedback.",,,,FALSE,high,
1928,REQ-CSVC-016,Functional,"The system shall provide capabilities or documented procedures and tools to support the migration of existing historical data from other systems (e.g., proprietary historians, SQL databases) into the system's designated time-series database. This includes support for data extraction, transformation (e.g., timestamp normalization, tag mapping, unit conversion), loading, and validation of migrated data.",Core OPC Client Services,"For customers with existing historical data in other systems... a comprehensive data migration plan will be developed. This includes defining procedures for data extraction, transformation... loading... and rigorous validation...",,,,FALSE,medium,
1929,REQ-CSVC-017,Functional,The OPC client library/service shall support the OPC Alarms and Conditions (A&C) specification for receiving and managing alarm and event notifications from OPC A&C servers. This includes enabling client applications to interact with alarm states such as prioritization and suppression.,Core OPC Client Services,"Supports the OPC Alarms and Conditions specification, enabling prioritization, suppression, and logging of alerts.",,,,FALSE,high,
1930,REQ-CSVC-018,Functional,"The OPC client library/service shall support alarm acknowledgement operations as defined by the OPC A&C specification. Received alarm records must contain at least: timestamp of occurrence, source node, event type, severity, condition name, message, acknowledged state, and timestamp of acknowledgment/return-to-normal. The service must support passing user identification and acknowledgement comments if provided by the calling application.",Core OPC Client Services,"Provides a user interface for acknowledging alarms. Alarm records will include at least: timestamp of occurrence, source node, event type, severity, condition name, message, acknowledged state, and timestamp of acknowledgment/return-to-normal.",,,,FALSE,high,
1931,REQ-CSVC-019,Functional,The OPC client system shall be capable of providing received alarm and event data for ingestion into a designated time-series database. Incoming alarm and event data from OPC A&C servers shall be validated by the client service to ensure required fields (as per REQ-CSVC-018) are present before provision for storage.,Core OPC Client Services,"Alarm and event data will be stored in a time-series database... Data validation rules for incoming alarm and event data (e.g., ensuring required fields are present) will be implemented.",,,,FALSE,high,
1932,REQ-CSVC-020,Functional,"The OPC client service shall generate distinct events or messages for alarms that can be consumed by higher-level system components to trigger configurable notification mechanisms (e.g., UI alerts, email, SMS) and to implement configurable alarm escalation policies for unacknowledged critical alarms.",Core OPC Client Services,The system will support configurable notification mechanisms for alarms... The system will support configurable alarm escalation policies for unacknowledged critical alarms.,,,,FALSE,high,
1933,REQ-CSVC-021,Functional,"The system shall ensure that all alarm lifecycle changes managed or initiated through the OPC client (e.g., acknowledgements, suppressions requested by the client) are auditable. This may involve the client service providing necessary data to a centralized audit logging mechanism.",Core OPC Client Services,"An audit trail will be maintained for all alarm lifecycle changes, including acknowledgments, suppressions, and configuration modifications.",,,,FALSE,high,
1934,REQ-CSVC-022,Functional,The system shall provide capabilities or documented procedures and tools to support the migration of existing alarm and event logs from legacy systems into the system's designated time-series database. This includes support for schema mapping and validation of migrated A&E data.,Core OPC Client Services,"Procedures for migrating existing alarm and event logs from legacy systems into the new time-series database will be defined, including schema mapping and validation, to ensure continuity of historical alarm analysis.",,,,FALSE,medium,
1935,REQ-CSVC-023,Functional,"The OPC client library/service shall support OPC UA subscriptions to monitored items for receiving real-time data changes and event notifications from OPC UA servers, reducing polling overhead. The service shall allow configuration of subscription parameters, including sampling interval, publishing interval, queue size, and deadbands for monitored items.",Core OPC Client Services,"Supports monitored items and notifications, reducing polling overhead. Configurable update rates for efficiency.",,,,FALSE,high,
1936,REQ-CSVC-024,NonFunctional,"The OPC client library/service shall ensure that subscription update notifications are delivered from the OPC UA server to the client application logic with a P99 latency of less than 100ms, under defined load conditions.",Core OPC Client Services,Subscription update delivery time should be less than 100ms (P99) from server to client application.,,,,FALSE,high,
1937,REQ-CSVC-025,Functional,"The OPC client library/service shall support OPC UA subscriptions over standard transport protocols, including OPC UA TCP (binary) and WebSockets with PubSub (using JSON or UADP encoding as specified by OPC UA standards).",Core OPC Client Services,"Underlying transport protocols for OPC UA subscriptions (e.g., OPC UA TCP, WebSockets with PubSub using JSON or UADP encoding) will be supported.",,,,FALSE,high,
1938,REQ-CSVC-026,Functional,"The OPC client library/service shall automatically detect subscription loss (e.g., due to network issues, server restart) and attempt to re-establish lost subscriptions. The service shall support client-side buffering of critical subscription data during short interruptions (configurable duration) to prevent data loss, and perform data integrity checks on buffered data upon successful re-establishment.",Core OPC Client Services,"Clear mechanisms will be in place for handling subscription loss (e.g., due to network issues or server restart) and automatically attempting re-establishment, including buffering of critical subscription data on the client-side where feasible to prevent data loss during short interruptions. Data integrity checks for buffered data upon re-establishment will be performed.",,,,FALSE,high,
1939,REQ-CSVC-027,Functional,"The system shall provide a mechanism or documented procedure to import existing subscription configurations (including monitored items, update rates, deadbands) from common legacy OPC client formats or spreadsheets, where feasible, to minimize reconfiguration effort.",Core OPC Client Services,"A method for migrating existing subscription configurations (monitored items, update rates, deadbands) from legacy OPC clients will be provided, where feasible, to minimize reconfiguration effort.",,,,FALSE,medium,
1940,REQ-CSVC-028,Functional,"The OPC client service shall provide status information regarding the health of subscriptions, including explicit indication of critical subscription loss, enabling higher-level system components to trigger alerts to operators or system administrators as per defined notification policies.",Core OPC Client Services,Loss of critical subscriptions must trigger an alert to operators or system administrators as per defined notification policies.,,,,FALSE,high,
1941,REQ-SAP-001,Technical,"The system MUST implement a hybrid architecture consisting of a core OPC client library/service and a separate server-side application. The core OPC client library/service MUST be developed using .NET 6 (or a later version) and MUST support cross-platform deployment on Windows, Linux, and macOS.",System Architecture & Platform,"The system will be built upon a hybrid architecture. This includes a core OPC client library/service developed using .NET 6+ for cross-platform compatibility (Windows, Linux, macOS).",,,,FALSE,high,
1942,REQ-SAP-002,Functional,"The server-side application MUST be developed using ASP.NET Core and MUST provide functionalities for centralized management, backend AI processing, and automated reporting services. It MUST also serve the web-based User Interface and expose RESTful APIs or gRPC endpoints for inter-service and external client communication.",System Architecture & Platform,"For advanced functionalities, a separate server-side application (e.g., built with ASP.NET Core using RESTful APIs or gRPC for inter-service communication [Essential for defining how different parts of the system and external clients interact with the backend]) will support centralized management, backend AI processing, automated reporting services, and will serve a web-based User Interface.",,,,FALSE,high,
1943,REQ-SAP-003,Technical,"The system MUST utilize gRPC for synchronous request/response interactions and message queues (e.g., RabbitMQ, Kafka) for asynchronous eventing between the core OPC client library/service and the server-side application. These communication protocols MUST be implemented to be efficient and secure.",System Architecture & Platform,"Communication between the core library/service and the server-side application will utilize efficient and secure protocols like gRPC or message queues (e.g., RabbitMQ, Kafka) depending on the interaction pattern (e.g., synchronous request/response vs. asynchronous eventing) [Essential for defining the internal system architecture and ensuring efficient, secure communication between components].",,,,FALSE,high,
1944,REQ-SAP-004,Technical,The system MUST use Protocol Buffers (Protobuf) as the data serialization format for all gRPC-based communication. JSON MUST be used as the data serialization format for all RESTful API communication.,System Architecture & Platform,Data serialization formats such as Protocol Buffers (Protobuf) for gRPC and JSON for RESTful APIs will be utilized.,,,,FALSE,high,
1945,REQ-SAP-005,Technical,"The system design documentation MUST include clearly defined data models for all inter-service communication. This includes message schemas for message queues and contract definitions (e.g., OpenAPI specifications for REST APIs, .proto files for gRPC) for all exposed APIs.",System Architecture & Platform,"Data models for inter-service communication, including message schemas for queues and contract definitions for APIs, will be clearly defined.",,,,FALSE,high,
1946,REQ-SAP-006,NonFunctional,"The system architecture MUST be modular, logically separating the core OPC client library/service, the server-side application, and its primary functional components (e.g., management, AI processing, reporting, UI services) to support independent scalability and enhance overall system maintainability.",System Architecture & Platform,This modular design ensures scalability and maintainability.,,,,FALSE,high,
1947,REQ-SAP-007,Technical,"The system's deployment methodology MUST support a phased rollout, enabling initial deployment and operation of core OPC client functionalities, followed by the incremental deployment of server-side components and subsequently advanced features.",System Architecture & Platform,"Deployment will follow a phased approach, potentially starting with core client functionalities followed by server-side components and advanced features.",,,,FALSE,medium,
1948,REQ-SAP-008,Technical,"The project execution plan MUST incorporate a pilot program conducted at selected customer sites. This program's objective is to validate the system architecture, core functionalities, and performance in a representative real-world industrial automation environment prior to wider deployment.",System Architecture & Platform,A pilot program with selected customer sites may be utilized to validate the architecture in a real-world environment before broader rollout.,,,,FALSE,medium,
1949,REQ-SAP-009,Functional,"The system MUST provide a documented strategy, and may include supporting tools or scripts, for migrating client configurations from common existing OPC client solutions to the new system's configuration database. This strategy MUST detail data mapping, transformation logic (if required), and procedures for validating migrated configurations.",System Architecture & Platform,"For customers transitioning from existing OPC client solutions, a strategy for migrating client configurations (e.g., server connection details, initial tag sets) to the new system's configuration database will be provided. This includes defining data mapping, transformation logic if needed, and validation procedures.",,,,FALSE,high,
1950,REQ-SAP-010,NonFunctional,The system MUST be designed to coexist and operate concurrently with existing legacy OPC client instances during a phased rollout period. This coexistence MUST NOT cause disruption to critical industrial operations reliant on these legacy clients or the shared OPC servers.,System Architecture & Platform,"During the transition period, the system must coexist with legacy OPC client instances if a phased rollout is adopted, ensuring no disruption to critical operations.",,,,FALSE,high,
1951,REQ-SAP-011,Technical,"The project deliverables MUST include clear, documented plans and procedures for the eventual and safe decommissioning of legacy OPC client systems that are replaced by the new system.",System Architecture & Platform,Clear plans for the eventual decommissioning of replaced legacy systems will be established.,,,,FALSE,medium,
1952,REQ-SAP-012,NonFunctional,"The system's design, development, deployment, and operational processes MUST adhere to the customer organization's documented existing enterprise architecture standards and IT governance policies applicable to new system deployments.",System Architecture & Platform,Adherence to the organization's existing enterprise architecture standards and IT governance policies for new system deployments must be ensured.,,,,FALSE,high,
1953,REQ-SAP-013,NonFunctional,"The official system documentation MUST clearly specify the minimum supported versions for each target operating system, including Windows (e.g., Windows 10, Windows Server 2016 or later), specific Linux distributions (e.g., Ubuntu LTS, RHEL), and macOS versions.",System Architecture & Platform,"Minimum supported OS versions will be documented (e.g., Windows 10 / Server 2016+, specific Linux distributions like Ubuntu LTS, RHEL, and macOS versions).",,,,FALSE,high,
1954,REQ-SAP-014,NonFunctional,"The official system documentation MUST provide typical resource requirements (CPU, RAM, disk space, network bandwidth) for both core OPC client instances and server-side application components. These requirements MUST be detailed for different deployment scales (e.g., small, medium, large, or based on tag count/user load).",System Architecture & Platform,"Typical resource requirements (CPU, RAM, disk space, network bandwidth) for client instances and server components will be provided for different deployment scales and documented.",,,,FALSE,high,
1955,REQ-SAP-015,Technical,"The system architecture MUST support hybrid cloud deployment models. This includes the capability for client management, backend AI processing, and other server-side application components to run in a cloud environment, while the core OPC client instance (deployable in a VM or container) operates on-premises and connects to local OPC servers.",System Architecture & Platform,"Cloud deployment models will be supported, allowing client management and AI components to run in the cloud, while the OPC client instance (potentially in a VM or container) connects to on-premises OPC servers...",,,,FALSE,high,
1956,REQ-SAP-016,Technical,"In hybrid cloud deployment models, all communication between on-premises OPC client instances and cloud-hosted server-side components MUST be conducted over a secure channel. The system or its deployment guide MUST support or recommend configurations for establishing such secure channels (e.g., site-to-site VPN, Azure ExpressRoute, AWS Direct Connect, or secure tunneling protocols like WireGuard/OpenVPN).",System Architecture & Platform,"...via a secure channel (e.g., site-to-site VPN, Azure ExpressRoute, AWS Direct Connect, or secure tunneling protocols like WireGuard/OpenVPN [Critical for secure hybrid cloud deployments]).",,,,FALSE,high,
1957,REQ-SAP-017,Technical,"The system components, including the core OPC client library/service and modules of the server-side application, MUST be deployable using Docker containers. Official Docker images or comprehensive build scripts for creating these images MUST be provided.",System Architecture & Platform,Docker will be recommended for containerization...,,,,FALSE,high,
1958,REQ-SAP-018,Technical,"The system's containerized components MUST be designed for compatibility with container orchestration platforms such as Kubernetes or Docker Swarm. For Kubernetes, deployment guides, manifests, or Helm charts SHOULD be provided to facilitate orchestration, particularly for larger deployments or microservice elements of the server-side application.",System Architecture & Platform,...with considerations for Kubernetes or Docker Swarm for orchestration in larger deployments or microservice-based components.,,,,FALSE,medium,
1959,REQ-SAP-019,Technical,"The project MUST provide Infrastructure as Code (IaC) scripts or templates, using tools such as Terraform, Pulumi, Azure Bicep/ARM Templates, or AWS CloudFormation, to enable automated, repeatable, and manageable provisioning of the system's required cloud-based infrastructure components.",System Architecture & Platform,"Infrastructure as Code (IaC) tools (e.g., Terraform, Pulumi, Bicep/ARM Templates, CloudFormation) will be utilized for managing and provisioning cloud deployments [Ensures repeatable and manageable cloud infrastructure provisioning].",,,,FALSE,high,
