id,req_id,category,formalized_text,feature_group,original_text,assumptions,constraints,dependencies,detail_analysis,priority,validation_criteria
2033,REQ-DLP-027,NonFunctional,"The system shall allow tuning of its configuration parameters (e.g., polling rates, subscription parameters, caching settings) to meet defined performance SLAs for data access and UI responsiveness, while operating within specified network bandwidth and server resource limitations as per organizational IT policies.",Data Lifecycle & Performance Management,"Business Rule: The system configuration must be tuned (e.g., polling rates, subscription parameters, caching settings) to meet the defined performance SLAs for data access and UI responsiveness, while respecting network bandwidth and server resource limitations as per organizational IT policies.",,,,FALSE,high,
2034,REQ-DLP-028,NonFunctional,"The system, in conjunction with monitoring tools, shall support the identification of performance degradation below agreed thresholds. Such events must trigger a documented investigation and corrective action planning process within the customer organization.",Data Lifecycle & Performance Management,Business Rule: Any performance degradation below agreed thresholds must trigger an investigation and corrective action plan.,,,,FALSE,medium,
2035,REQ-DLP-029,Functional,"The system's configurable data retention policies shall enable customers to set retention periods for all managed data types (historical, alarms, AI, audit trails) in a manner that complies with applicable legal statutes and industry-specific regulations relevant to the customer.",Data Lifecycle & Performance Management,"Business Rule: Data retention periods for all data types must comply with applicable legal statutes (e.g., Sarbanes-Oxley, HIPAA) and industry-specific regulations (e.g., NERC CIP for energy, FDA regulations for pharma).",,,,FALSE,high,
2036,REQ-DLP-030,Functional,"All data purging actions, whether automated by policy or manually initiated, shall be recorded in an audit log. Manual purging operations outside of automated policy shall require a mechanism for recording approval or authorization, if supported by the system's workflow, or be subject to external organizational approval processes.",Data Lifecycle & Performance Management,"Business Rule: Data purging must be an auditable process, with clear approvals required for manual purges outside of automated policy.",,,,FALSE,high,
2037,REQ-DLP-031,NonFunctional,"The system documentation shall recommend and support periodic review and testing (e.g., annually) of data backup and recovery procedures by the customer to ensure their continued effectiveness and compliance with defined RTO/RPO targets for system-managed data.",Data Lifecycle & Performance Management,"Business Rule: Periodic review and testing of data backup and recovery procedures (e.g., annually) are mandatory to ensure their effectiveness and compliance with RTO/RPO targets for system-managed data.",,,,FALSE,medium,
2038,REQ-DLP-032,NonFunctional,The system documentation shall advise the customer organization to define clear data ownership and stewardship roles and responsibilities for all data types managed by the OPC client system.,Data Lifecycle & Performance Management,Business Rule: Clear data ownership and stewardship roles and responsibilities within the customer organization must be defined for all data managed by the system.,,,,FALSE,low,
2039,REQ-6-001,Functional,"The system shall provide a web-based dashboard, served by the server-side application, enabling centralized monitoring and comprehensive configuration of all OPC client instances, including headless ones, across multiple sites.",System Operations & Centralized Management,"Provides a web-based dashboard, served by the server-side application component of the hybrid architecture, for monitoring and comprehensively configuring clients across sites. This includes the ability to fully manage all client instances, including those deployed headlessly.",,,,FALSE,high,
2040,REQ-6-002,Functional,"The centralized management dashboard shall support bulk operations for simultaneous configuration (e.g., deploying standard configurations) and software updates of multiple selected client instances. It shall prominently display aggregated Key Performance Indicators (KPIs) for overall health, connectivity, and performance of all managed clients, based on defined and documented data sources.",System Operations & Centralized Management,"The centralized dashboard will support bulk operations for configuring multiple client instances simultaneously (e.g., deploying standard configurations, updating software). Key Performance Indicators (KPIs) summarizing the overall health, connectivity, and performance of all managed client instances will be prominently displayed on the centralized dashboard, with defined data sources for these KPIs.",,,,FALSE,high,
2041,REQ-6-003,NonFunctional,"All administrative functions available through the centralized management dashboard shall be clearly documented. Access to the dashboard and its functions shall be strictly controlled via Role-Based Access Control (RBAC). All significant administrative actions performed via the dashboard (e.g., configuration changes, bulk operations, user management) shall be logged in an audit trail.",System Operations & Centralized Management,"Administrative functions available through this interface will be clearly documented. Access to the centralized management dashboard must be strictly controlled and audited, given its wide-ranging control capabilities. Administrative responsibilities and procedures for using the centralized management dashboard, including who can perform bulk operations or deploy configurations, must be clearly defined and documented.",,,,FALSE,high,
2042,REQ-6-004,Functional,"The system shall implement comprehensive structured logging for all its components, utilizing frameworks like Serilog or NLog for .NET applications. Logs must include timestamp, severity level, source component, and relevant contextual information. The system shall track and make accessible specific Key Performance Indicators (KPIs) for client and server health, including: OPC server connection status and round-trip time, subscription queue lengths, message processing rates, CPU/memory/disk utilization of client and server components, and API request latency and error rates.",System Operations & Centralized Management,"Implements comprehensive logging capabilities, including structured logs using a framework like Serilog or NLog for .NET applications. Log data will include timestamps, severity levels, source component, and relevant contextual information. Key Performance Indicators (KPIs) for client health... will be tracked. Specific KPIs to be monitored will include (but not be limited to): OPC server connection status and round-trip time, subscription queue lengths, message processing rates, CPU/memory/disk utilization of client and server components, API request latency and error rates.",,,,FALSE,high,
2043,REQ-6-005,Functional,"The system shall allow configuration of alerting thresholds for the tracked Key Performance Indicators (KPIs). It shall support configurable application log rotation and retention policies to manage disk space and ensure diagnostic data availability. The system must provide mechanisms to integrate with external log aggregation/analysis tools (e.g., ELK Stack, Splunk, Azure Monitor Logs, AWS CloudWatch Logs) and standard monitoring/observability platforms (e.g., Prometheus, Grafana, Azure Monitor, AWS CloudWatch) for real-time monitoring and alerting.",System Operations & Centralized Management,"Alerting thresholds for these KPIs will be configurable. Logs will be aggregated and analyzed using tools like the ELK Stack... Application log rotation and retention policies will be configurable... The system will support integration with standard monitoring and observability platforms (e.g., Prometheus, Grafana...)",,,,FALSE,high,
2044,REQ-6-006,NonFunctional,"The system shall implement distributed tracing, using OpenTelemetry standards, for requests that span multiple services within its hybrid architecture. The server-side application components shall be designed and deployed to achieve a target availability of 99.9% uptime, excluding scheduled maintenance periods.",System Operations & Centralized Management,"Distributed tracing (e.g., using OpenTelemetry) will be implemented for requests spanning multiple services within the hybrid architecture. The server-side application components will have a defined target availability (e.g., 99.9% uptime, excluding scheduled maintenance).",,,,FALSE,high,
2045,REQ-6-007,NonFunctional,"The system shall support the delivery of regular software updates, including new features, security patches, and compatibility improvements, via a secure mechanism (e.g., signed packages, secure download portal). A documented rollback strategy must be provided to allow reversion to a previous stable version in case of critical issues with an update. Each software update must be accompanied by comprehensive release notes detailing new features, improvements, bug fixes, and any breaking changes.",System Operations & Centralized Management,"Delivers new features, security patches, and compatibility improvements regularly... Updates will be delivered via a secure mechanism... A documented rollback strategy will be in place... Comprehensive release notes detailing new features, improvements, bug fixes, and any breaking changes will accompany each update.",,,,FALSE,high,
2046,REQ-6-008,Technical,"Software updates provided for the system shall be developed using a version control system (e.g., Git) and processed through a Continuous Integration/Continuous Deployment (CI/CD) pipeline that automates building and testing. The quality assurance process for updates must include comprehensive testing encompassing unit, integration, end-to-end, performance (against defined criteria), and security (SAST, DAST, penetration) testing prior to release.",System Operations & Centralized Management,"Development will use a version control system (e.g., Git)... A CI/CD pipeline... will automate building, testing, and deploying updates. The testing strategy will encompass unit tests..., integration tests..., end-to-end tests..., performance tests..., and security testing (SAST, DAST, penetration testing).",,,,FALSE,high,
2047,REQ-6-009,NonFunctional,"The system documentation shall provide clear guidance and recommendations for customer organizations regarding patching schedules, particularly for critical security vulnerabilities. It shall also outline best practices for defining internal responsibilities and procedures for testing updates in a staging environment, approving them for production, and applying them during scheduled maintenance windows, in alignment with their internal change management and IT security policies.",System Operations & Centralized Management,"The customer organization must adhere to vendor-recommended patching schedules... Organizational responsibilities for testing updates in a staging environment, approving them for production, and applying them during scheduled maintenance windows must be clearly defined.",,,,FALSE,medium,
2048,REQ-7-001,Functional,"The system shall integrate pre-trained predictive maintenance models, supporting ONNX format for interoperability, to analyze historical data and forecast equipment maintenance needs. The system shall support running these models on edge devices for low-latency predictions.",Advanced Analytics & Artificial Intelligence (AI/ML),Integrates pre-trained models (potentially in ONNX format for interoperability) to analyze historical data and forecast maintenance needs. Can run on edge devices for low-latency predictions.,,,,FALSE,high,
2049,REQ-7-002,Functional,"The system shall enforce and utilize clearly documented input data requirements for predictive maintenance models, including specific sensor data, operational parameters, data formats, expected data quality levels, and mechanisms for handling missing or anomalous input data.",Advanced Analytics & Artificial Intelligence (AI/ML),"Input data requirements for pre-trained models (e.g., specific sensor data, operational parameters, data formats, expected data quality levels including handling of missing or anomalous input data) will be clearly documented.",,,,FALSE,high,
2050,REQ-7-003,Technical,"The system shall support the execution of predictive maintenance models developed using AI/ML frameworks including TensorFlow, PyTorch, scikit-learn, and ML.NET, primarily through ONNX or other specified interoperable formats.",Advanced Analytics & Artificial Intelligence (AI/ML),"AI/ML frameworks such as TensorFlow, PyTorch, scikit-learn, or ML.NET will be utilized for model development and execution.",,,,FALSE,medium,
2051,REQ-7-004,Functional,"The system shall provide AI model management capabilities for predictive maintenance, including deploying and versioning models, monitoring model performance for drift (e.g., accuracy degradation), and supporting a retraining strategy. Integration with MLOps platforms (e.g., MLflow, Kubeflow, Azure ML, AWS SageMaker) shall be supported.",Advanced Analytics & Artificial Intelligence (AI/ML),"A comprehensive AI model management strategy will be defined, including processes for deploying and versioning pre-trained models, monitoring their performance over time for drift, and outlining a retraining strategy, potentially using MLOps platforms/tools (e.g., MLflow, Kubeflow, Azure Machine Learning, AWS SageMaker).",,,,FALSE,high,
2052,REQ-7-005,Functional,"The system shall provide model explainability features (e.g., SHAP, LIME) for predictive maintenance predictions where feasible. It shall include a user feedback mechanism to validate or correct predictions, with feedback logged for model refinement. The system shall allow authorized users to upload pre-trained custom models or fine-tune existing models with their operational data.",Advanced Analytics & Artificial Intelligence (AI/ML),"The system will aim to provide model explainability features (e.g., using techniques like SHAP or LIME where feasible) to help users understand the basis of predictions. A feedback mechanism will allow users to validate or correct maintenance predictions, which can be used for future model refinement. The system may allow users to upload or train custom models, or fine-tune existing ones with their specific operational data.",,,,FALSE,medium,
2053,REQ-7-006,Technical,"The system shall store AI-related unstructured data and model artifacts (e.g., model parameters, feature vectors, training datasets metadata) using NoSQL databases (e.g., MongoDB) or blob storage, with defined schemas or structures for organization, versioning, and retrieval.",Advanced Analytics & Artificial Intelligence (AI/ML),"AI-related unstructured data or model artifacts may utilize NoSQL databases (e.g., MongoDB) or blob storage, with defined schemas or structures.",,,,FALSE,medium,
2054,REQ-7-007,NonFunctional,"The system's predictive maintenance features, including model development, training, fine-tuning, and deployment, shall adhere to documented ethical AI principles (fairness, transparency, accountability) and comply with applicable data privacy regulations (e.g., GDPR, CCPA) for all data used. Data privacy for customer-specific data shall be ensured throughout the model lifecycle.",Advanced Analytics & Artificial Intelligence (AI/ML),"Data privacy considerations for data used in model training or fine-tuning, especially if customer-specific data is involved, will be addressed. Ethical AI principles, including fairness, transparency, and accountability, must guide the development and deployment of predictive maintenance models. All data used for training must comply with data privacy regulations.",,,,FALSE,high,
2055,REQ-7-008,Functional,"The system shall employ AI models (statistical or deep learning) to detect and flag anomalies in real-time operational data. It shall support detection of point anomalies, contextual anomalies, and collective anomalies. The system shall allow configuration of detection thresholds and generate alerts for detected anomalies.",Advanced Analytics & Artificial Intelligence (AI/ML),"Detects unusual patterns in real-time data using AI. Employs statistical or deep learning models to flag anomalies. The system will be designed to detect various types of anomalies, including point, contextual, and collective anomalies. Configurable thresholds and alerts.",,,,FALSE,high,
2056,REQ-7-009,Functional,"The system shall enforce and utilize clearly documented input data requirements for anomaly detection models, including expected data quality levels, data sources, and necessary preprocessing steps.",Advanced Analytics & Artificial Intelligence (AI/ML),"Input data requirements, including expected data quality and preprocessing steps for anomaly detection models, will be documented.",,,,FALSE,high,
2057,REQ-7-010,Functional,"The system shall provide AI model management for anomaly detection, consistent with REQ-7-004, including model deployment, versioning, performance monitoring (e.g., false positive/negative rates), and retraining strategies. This includes support for user customization of anomaly detection models and adherence to data privacy for training data.",Advanced Analytics & Artificial Intelligence (AI/ML),"The AI model management strategy, AI/ML frameworks, and MLOps considerations (as detailed in AI-Driven Predictive Maintenance), including data privacy for training data, will also apply here, covering deployment, versioning, performance monitoring, retraining, and potential user customization of anomaly detection models.",,,,FALSE,high,
2058,REQ-7-011,Functional,"The system shall provide a user interface for authorized users to review details of detected anomalies, label them (e.g., true positive, false positive, specific anomaly type), and manage their lifecycle. This feedback shall be logged and made available for model retraining and performance improvement.",Advanced Analytics & Artificial Intelligence (AI/ML),"A user interface will be provided for reviewing, labeling, and managing detected anomalies, facilitating model retraining and performance improvement.",,,,FALSE,high,
2059,REQ-7-012,Functional,"The system shall support configurable workflows for reviewing, investigating, and responding to detected anomalies, including mechanisms for escalation of critical anomalies. The system must provide tools and metrics to facilitate regular review of anomaly detection model performance (e.g., false positive/negative rates, precision, recall) and support model retraining or adjustment using user feedback.",Advanced Analytics & Artificial Intelligence (AI/ML),"Business Rule: A defined workflow for reviewing, investigating, and responding to detected anomalies must be established. Business Rule: The performance of anomaly detection models must be regularly reviewed, and models retrained or adjusted as necessary. User feedback is critical.",,,,FALSE,high,
2060,REQ-7-013,Functional,"The system shall enable users to query OPC data using natural language text input via the user interface. The system shall also support voice input for submitting natural language queries, if the Voice Control feature is enabled.",Advanced Analytics & Artificial Intelligence (AI/ML),Enables data queries using natural language. Supports voice input.,,,,FALSE,medium,
2061,REQ-7-014,Functional,"The system shall integrate Natural Language Processing (NLP) capabilities, supporting specified services (e.g., Google Cloud NL, Azure Cognitive Services, or on-premise spaCy), for intent recognition and entity extraction from user queries. The system shall support a documented list of languages for NLQ, starting with English, with an architecture allowing for future language expansion.",Advanced Analytics & Artificial Intelligence (AI/ML),"Integrates NLP (e.g., Google Cloud Natural Language, Azure Cognitive Service for Language, or open-source libraries like spaCy if on-premise solutions are needed) to process queries. This involves intent recognition and entity extraction capabilities. Supported languages for Natural Language Querying will be specified.",,,,FALSE,high,
2062,REQ-7-015,Functional,"The system shall provide a user-configurable mapping or aliasing system allowing authorized users to define semantic names, contexts, or tags for OPC data points (e.g., mapping 'TT-101' to 'Reactor 1 Temperature'). This metadata shall be utilized by the NLP engine to improve the interpretation accuracy of queries specific to the user's operational environment.",Advanced Analytics & Artificial Intelligence (AI/ML),"A user-configurable mapping or aliasing system will be provided, allowing users to define semantic names, contexts, or tags for their OPC data points. This metadata enables the NLP engine to correctly interpret queries related to their specific plant, equipment, or processes.",,,,FALSE,high,
2063,REQ-7-016,NonFunctional,"The system shall implement robust error handling for external NLP service integrations, including configurable retries and circuit breaker patterns. For ambiguous or unrecognized natural language queries, the system shall provide fallback mechanisms, such as offering alternative interpretations, asking for clarification, or guiding the user to manual browsing/querying tools.",Advanced Analytics & Artificial Intelligence (AI/ML),"Robust error handling, retry mechanisms, circuit breaker patterns, and fallback strategies will be implemented for the integration with external NLP services. The system will include a fallback mechanism for ambiguous or unrecognized queries.",,,,FALSE,medium,
2064,REQ-7-017,NonFunctional,"The system shall ensure data privacy for logged natural language queries and any associated voice input data, particularly if processed by third-party NLP services. This includes compliance with relevant data privacy regulations and providing options for data anonymization or on-premise processing for sensitive environments.",Advanced Analytics & Artificial Intelligence (AI/ML),"Data privacy considerations for logged queries or voice input data will be addressed, especially if processed by third-party services.",,,,FALSE,high,
2065,REQ-7-018,Functional,"The system shall use AI capabilities to generate reports that summarize data trends, highlight detected anomalies, and identify key performance indicators (KPIs) and potential operational issues from OPC and related data sources.",Advanced Analytics & Artificial Intelligence (AI/ML),"Generates reports based on data trends and anomalies. Uses AI to create customized reports, highlighting KPIs and issues.",,,,FALSE,high,
2066,REQ-7-019,Functional,"The system shall provide a user interface for authorized users to create and customize report templates, allowing selection of data sources (OPC tags, historical data, AI model outputs), KPIs, chart types, and branding elements (e.g., logos, color schemes). Data models for report inputs shall be clearly defined, and the system shall implement data validation rules for these inputs.",Advanced Analytics & Artificial Intelligence (AI/ML),"Users will have options to customize report templates, including selecting data sources, KPIs, chart types, and branding elements. Data validation rules for inputs to report generation will be implemented.",,,,FALSE,high,
2067,REQ-7-020,Functional,"The system shall support scheduled (e.g., daily, weekly) and event-triggered generation of AI-driven reports. Reports shall be exportable in PDF, Excel, and HTML formats. The system shall support report distribution via email, download from the web UI, and saving to configured network locations. Data retention policies for generated reports shall be configurable by administrators.",Advanced Analytics & Artificial Intelligence (AI/ML),"Supports scheduled or event-triggered reporting in various formats (e.g., PDF, Excel, HTML). Reports can be distributed via multiple channels. Data retention policies for generated reports will be configurable.",,,,FALSE,high,
2068,REQ-7-021,Technical,"The server-side application component shall host backend services for AI-driven report generation, utilizing specified reporting libraries or tools (e.g., QuestPDF, ClosedXML for .NET). The system may also support integration with external Business Intelligence (BI) platforms for advanced reporting capabilities.",Advanced Analytics & Artificial Intelligence (AI/ML),"Backend services for AI and reporting will be part of the server-side application component, utilizing reporting generation libraries or tools (e.g., QuestPDF, ClosedXML for .NET, or integration with BI platforms).",,,,FALSE,medium,
2069,REQ-7-022,Functional,"The system shall support version control and archiving for generated reports, particularly those designated as containing regulatory compliance data, adhering to configured data retention policies. The system shall integrate with RBAC to manage distribution lists and access permissions for sensitive reports. The system shall provide mechanisms to support customer-defined workflows for validation and sign-off of AI-generated reports before official dissemination.",Advanced Analytics & Artificial Intelligence (AI/ML),Business Rule: All automated reports containing regulatory compliance data must be version-controlled and archived. Business Rule: The distribution list and access permissions for sensitive reports must be managed. Business Rule: A validation and sign-off process may be required for certain types of AI-generated reports.,,,,FALSE,medium,
