id,req_id,category,formalized_text,feature_group,original_text,assumptions,constraints,dependencies,detail_analysis,priority,validation_criteria
1960,REQ-SAP-020,Technical,"As part of the implementation process, pilot deployments of the core OPC client library/service MUST be conducted on each supported target operating system (Windows, Linux, macOS) within the customer's specific IT environment. These pilots aim to validate platform-specific dependencies, integration, and performance characteristics.",System Architecture & Platform,A pilot deployment on each target operating system within the customer's environment will be conducted to validate platform-specific dependencies and performance.,,,,FALSE,medium,
1961,REQ-SAP-021,Technical,"The provided Infrastructure as Code (IaC) templates for cloud deployments MUST be designed to be customizable to accommodate specific customer cloud subscription details, existing networking topology, and security policies.",System Architecture & Platform,"For cloud deployments, IaC templates will be customized to fit the customer's cloud subscription and networking topology.",,,,FALSE,medium,
1962,REQ-SAP-022,Technical,"The project MUST provide documented, detailed cutover plans for scenarios involving the migration of OPC client instances from one operating system to another (e.g., Windows to Linux). These plans MUST include procedures for secure configuration transfer, comprehensive pre- and post-migration testing, and clearly defined rollback mechanisms.",System Architecture & Platform,"If migrating client instances between operating systems (e.g., from an old Windows-based client to a new Linux-based instance), detailed cutover plans including configuration transfer, testing, and rollback procedures are required.",,,,FALSE,medium,
1963,REQ-SAP-023,NonFunctional,"All system deployments, whether on-premises or in the cloud, MUST comply with the customer's documented organizational IT infrastructure standards. This includes adherence to approved operating system versions, security patching levels, and any applicable containerization policies.",System Architecture & Platform,"All deployments must comply with the customer's organizational IT infrastructure standards, including approved OS versions, patching levels, and containerization policies.",,,,FALSE,high,
1964,REQ-SAP-024,NonFunctional,"The actual system resources (CPU, RAM, disk, network) allocated for deployed core OPC client instances and server-side application components MUST align with the officially documented resource requirements for the intended scale and load. The system or associated monitoring tools MUST facilitate monitoring of these allocated resources to help ensure that performance Service Level Agreements (SLAs) are consistently met.",System Architecture & Platform,Resource allocation for client instances and server components must align with documented requirements and be monitored to ensure performance SLAs are met.,,,,FALSE,high,
1965,REQ-3-001,Functional,"The system shall implement OPC UA standard security mechanisms, including certificate-based authentication, message signing, user authentication as per OPC UA specifications, and 128/256-bit encryption for all OPC UA communication.",Security & Access Control,"Implements certificate-based authentication, 128/256-bit encryption (e.g., AES-256 for data at rest), message signing, and user authentication per OPC UA standards.",,,,FALSE,high,
1966,REQ-3-002,NonFunctional,"The system shall encrypt all sensitive data at rest, including user configurations, designated sensitive data in relational databases, alarm/event logs, and historical process values in specialized databases, using AES-256 or an equivalently strong encryption algorithm.",Security & Access Control,"AES-256 for data at rest...User configurations and other specifically designated sensitive data will be stored using a relational database...with appropriate security measures including encryption at rest. Other categories of data that may be sensitive, such as alarm/event logs or historical process values, will be stored in their respective specialized databases...with security measures equivalent...ensuring consistent and robust security across all data stores handling sensitive information.",,,,FALSE,high,
1967,REQ-3-003,Functional,"The system shall implement a Role-Based Access Control (RBAC) mechanism to govern access to system functionalities and data. It shall provide predefined, customizable roles (e.g., Administrator, Engineer, Operator, Viewer) with defined permission sets. All user and role management actions shall be logged.",Security & Access Control,"Supports role-based access control (RBAC)...The system will provide a set of predefined default roles (e.g., Administrator, Engineer, Operator, Viewer) with typical permission sets, which can be customized. The data model for user roles and permissions will be defined. All user management actions (creation, deletion, role changes, permission modifications) will be logged in an audit trail.",,,,FALSE,high,
1968,REQ-3-004,Functional,"The system shall support integration with external Identity Providers (IdPs) such as Keycloak, Azure AD, or Okta, using OAuth 2.0/OpenID Connect protocols for user authentication and authorization to the web UI and APIs. Configuration shall allow defining scopes, claims, and redirect URIs.",Security & Access Control,"potentially integrated with an Identity Provider (IdP) using OAuth 2.0/OpenID Connect (e.g., Keycloak, Azure AD, Okta) for managing user identities and access to the web UI and APIs. Integration with an existing corporate IdP will require collaborative planning...including defining scopes, claims, and redirect URIs. A pilot integration phase is recommended.",,,,FALSE,high,
1969,REQ-3-005,Functional,"The system shall provide an internal user management system with configurable password policies, including minimum length, complexity requirements (e.g., uppercase, lowercase, numbers, symbols), password history enforcement, and account lockout after multiple failed attempts, if an external IdP is not used or used in conjunction.",Security & Access Control,"If an internal user management system is utilized...it will enforce configurable password policies (e.g., complexity, length, history, expiration).",,,,FALSE,high,
1970,REQ-3-006,NonFunctional,"The system shall implement secure cryptographic key management procedures for all keys used (e.g., for data encryption, message signing), including cryptographically secure generation, secure storage (e.g., HSM, secure vault), periodic rotation, and timely revocation, adhering to industry best practices.",Security & Access Control,"Key management procedures will be established for managing cryptographic keys, including generation, storage, rotation, and revocation, adhering to industry best practices.",,,,FALSE,high,
1971,REQ-3-007,NonFunctional,"The system shall employ secure credential management for its internal components and communications with external services, utilizing mechanisms such as Hardware Security Modules (HSMs) where appropriate, or managed identity services (e.g., Azure Managed Identities, AWS IAM Roles) for cloud-deployed resources, avoiding hardcoded credentials.",Security & Access Control,"Additionally, the system will incorporate secure credential management (e.g., using hardware security modules where appropriate, or managed identity services like Azure Managed Identities or AWS IAM Roles for cloud resources)",,,,FALSE,high,
1972,REQ-3-008,Functional,"The system shall ensure the integrity of AI models (e.g., through checksums, digital signatures) to prevent unauthorized modification and implement access controls to manage deployment, configuration, and interaction with AI models and their outputs based on user roles.",Security & Access Control,ensure AI model integrity and implement access controls for AI models,,,,FALSE,medium,
1973,REQ-3-009,NonFunctional,"The system shall ensure end-to-end encryption using strong, current cryptographic protocols (e.g., TLS 1.2+ with strong cipher suites) for all communications between client instances/users and the centralized management interface.",Security & Access Control,provide end-to-end encryption for communications with the centralized management interface.,,,,FALSE,high,
1974,REQ-3-010,Functional,"The system's server-side application endpoints (e.g., RESTful APIs, gRPC services) shall be protected using robust authentication methods, such as JSON Web Tokens (JWT) with proper validation (signature, expiry, audience) or securely managed API Keys.",Security & Access Control,"Secure API authentication methods (e.g., JWT, API Keys) will be used for server-side application endpoints [Essential for protecting backend services].",,,,FALSE,high,
1975,REQ-3-011,NonFunctional,"The system shall be designed to support and facilitate regular security audits. It must provide mechanisms for designated personnel to review and audit access rights, security configurations (including firewall rules for inter-service communication), and compliance with security policies periodically.",Security & Access Control,"Regular security audits will be mandated. Access rights and security configurations (including firewall rules for service communication) must be reviewed and audited periodically (e.g., quarterly or annually) by designated security personnel, in line with organizational policy.",,,,FALSE,medium,
1976,REQ-3-012,Functional,"The system shall implement comprehensive and immutable audit logging to capture security-relevant events. This includes, but is not limited to, successful and failed login attempts, authorization changes (e.g., role assignments, permission modifications), administrative actions (e.g., system configuration changes), and access to data classified as sensitive. Logs must include timestamp, user identity, action performed, outcome, and relevant resource identifiers.",Security & Access Control,"Comprehensive audit logging will capture security-relevant events, including login attempts (successful and failed), authorization changes, administrative actions, and access to sensitive data.",,,,FALSE,high,
1977,REQ-3-013,Functional,"The system shall support data classification (e.g., Confidential, Restricted, Internal, Public) for data it manages. Appropriate protection mechanisms, such as access controls and encryption, shall be applied based on these classifications, ensuring least privilege access.",Security & Access Control,"Data will be classified (e.g., Confidential, Restricted, Internal, Public), and protection mechanisms will be applied accordingly.",,,,FALSE,medium,
1978,REQ-3-014,Functional,"The system shall be designed to facilitate compliance with applicable data privacy regulations (e.g., GDPR, CCPA). It must provide documented procedures and, where feasible, tools to support Data Subject Access Requests (DSARs), including the right to access, rectify, and request erasure or anonymization of personal data stored within its user management system and relevant audit logs, subject to legal retention requirements.",Security & Access Control,"Compliance with relevant data privacy regulations (e.g., GDPR, CCPA...)...The system must provide mechanisms to support data subject access requests (DSAR) and the right to erasure/anonymization for personal data stored within its user management or audit log components, as mandated by GDPR/CCPA.",,,,FALSE,high,
1979,REQ-3-015,Functional,"The system shall provide capabilities for data masking or anonymization of sensitive data. This functionality should be available for use in non-production environments (e.g., development, testing) or for specific use cases requiring de-identified data, ensuring that original sensitive information is not exposed.",Security & Access Control,"Where applicable for non-production environments or specific use cases, data masking or anonymization techniques will be available for sensitive data.",,,,FALSE,medium,
1980,REQ-3-016,Technical,"The system shall support or provide documented strategies for user data migration. This includes mapping existing user accounts and permissions to IdP identities when transitioning to an IdP, and defining processes for secure migration of user credentials (if compliant) or a mandatory password reset process when transitioning between internal user management systems.",Security & Access Control,"If migrating from a system with local user management to an IdP-integrated solution, a strategy for mapping existing user accounts and permissions to IdP identities will be required. For transitions between internal user management systems, secure migration of user credentials (if possible and compliant) or a password reset process will be defined.",,,,FALSE,medium,
1981,REQ-3-017,NonFunctional,"The solution shall include provisions for security-focused training materials and documentation. Administrator training materials shall cover RBAC management, IdP integration procedures, certificate lifecycle management, and interpretation of security audit logs. User training materials shall cover secure login procedures, password management best practices, and awareness of social engineering threats.",Security & Access Control,"Administrators will require training on managing RBAC, IdP integration, certificate management, and interpreting security audit logs. Users will be trained on secure login procedures and password policies.",,,,FALSE,medium,
1982,REQ-3-018,NonFunctional,The system's operational documentation and recommended procedures shall require that all detected security incidents or vulnerabilities related to the OPC client system are reported and managed in accordance with the customer organization's established incident response plan. The system should facilitate this by providing relevant logs and diagnostic information.,Security & Access Control,All security incidents or detected vulnerabilities must be reported and managed according to the organization's established incident response plan.,,,,FALSE,high,
1983,REQ-UIX-001,NonFunctional,"The system shall provide an intuitive Graphical User Interface (GUI) for configuration and monitoring.
The UI technology shall support cross-platform deployment.
Web-based UI components shall adhere to WCAG 2.1 Level AA accessibility standards; desktop UI (if any) shall adhere to platform-specific accessibility guidelines.
Both web and desktop UIs shall support comprehensive keyboard navigation and screen reader compatibility.
The UI shall be responsive, adapting to screen sizes from standard desktop monitors to tablet displays.
The UI shall integrate user feedback mechanisms: progress indicators, success/error messages, and contextual help.",User Interface & Experience (UI/UX),"Offers an intuitive GUI for configuration and monitoring. The UI technology will be chosen to support cross-platform deployment and accessibility. The interface will adhere to WCAG 2.1 Level AA accessibility standards for web-based components and platform-specific accessibility guidelines for desktop applications, including comprehensive keyboard navigation and screen reader compatibility. The UI will be designed for responsiveness across various screen sizes and resolutions, from standard desktop monitors to tablet displays. User feedback mechanisms, such as progress indicators, success/error messages, and contextual help, will be integrated throughout the UI.",,,,FALSE,high,
1984,REQ-UIX-002,Functional,"The system shall provide a web-based UI, recommended to be built with Blazor WebAssembly and served by the .NET backend, for accessibility and centralized management.
This web UI must provide comprehensive client configuration capabilities (e.g., tag configuration, namespace browsing) adapted for a web environment.
The web UI shall enable full management of all OPC client instances, including headless ones.
A suitable state management solution shall be employed for the web UI to manage complexity and maintainability.",User Interface & Experience (UI/UX),"For broader accessibility and centralized management, a web-based UI using Blazor WebAssembly served by the .NET backend is recommended; this web-based interface must incorporate comprehensive client configuration capabilities, including functionalities equivalent to 'tag configuration' and 'namespace browsing' (adapted for a web environment), to ensure full management of all client instances, including headless ones. State management solutions (e.g., Blazor's built-in mechanisms, or Redux/NgRx if a JavaScript framework is chosen) will be employed for complex UIs.",,,,FALSE,high,
1985,REQ-UIX-003,Functional,"If desktop applications are developed for local client interaction, they shall utilize cross-platform frameworks such as Avalonia UI or Uno Platform.
The desktop UI shall provide functionalities for local client configuration and monitoring, including tag configuration and namespace browsing.",User Interface & Experience (UI/UX),"For desktop applications, frameworks like Avalonia UI or Uno Platform will be considered for local client interaction.",,,,FALSE,medium,
1986,REQ-UIX-004,Functional,"The UI (both web and desktop, if applicable) shall provide functionality for users to configure OPC tags.
This includes support for drag-and-drop style interactions for tag configuration where appropriate and feasible.
The UI shall enable users to browse OPC server namespaces to discover available tags and data structures.",User Interface & Experience (UI/UX),"Includes features such as tag configuration (e.g., drag-and-drop style interactions where appropriate), namespace browsing...",,,,FALSE,high,
1987,REQ-UIX-005,Functional,"The UI shall feature customizable dashboards for real-time and historical data visualization.
Users shall be able to create, modify, and save dashboard layouts, selecting data points and visualization types.
Dashboards shall utilize specified charting libraries to display trends, gauges, and other visual elements.
The UI shall support visualization of aggregated and filtered historical data on these dashboards.",User Interface & Experience (UI/UX),"customizable dashboards for data visualization using charting libraries (e.g., Chart.js, Plotly.js, or .NET-based libraries like Syncfusion/Telerik UI components [Essential for dashboards and trend visualization]).",,,,FALSE,high,
1988,REQ-UIX-006,Functional,"The UI shall support localization into multiple languages, initially including English, German, Spanish, and Chinese.
The system shall provide a framework enabling straightforward addition of new languages.
Localization shall encompass UI text, number formats, and date/time formats, ensuring UTF-8 text encoding for all supported languages.
The default language and regional settings for the UI shall be configurable based on site or user preferences.",User Interface & Experience (UI/UX),"Target languages for localization will be specified based on market requirements (e.g., English, German, Spanish, Chinese), with a framework allowing for straightforward addition of new languages. If multi-language support is required, the UI and documentation must be localizable, supporting target languages (to be specified), different number formats, date/time formats, and UTF-8 text encoding. The default language and regional settings for the UI will be configurable based on site or user preferences, aligning with organizational policies for multilingual environments.",,,,FALSE,medium,
1989,REQ-UIX-007,Functional,"The UI shall allow users to view current values of OPC tags in real-time.
The UI shall enable authorized users to write new values to OPC tags.
The UI shall display clear, user-friendly status messages for both successful and failed read/write operations, including details for errors like communication timeouts, connection loss, or invalid tag addresses.",User Interface & Experience (UI/UX),"Allows users to browse server namespaces, read current tag values, and write updates. Error handling for failed read/write operations (e.g., communication timeouts, connection loss, invalid tag address) will be implemented, providing clear status codes and messages to the calling application or UI.",,,,FALSE,high,
1990,REQ-UIX-008,Functional,"The UI shall provide tools for querying and visualizing historical data from OPC HDA servers or the system's time-series database.
Users shall be able to specify time ranges, select tags, and apply data aggregation functions via the UI.
Trend visualization tools within the UI shall allow users to analyze historical data patterns.
The UI shall display results of HDA queries, with query response times for a 1-day range of 100 tags aimed to be less than 2 seconds for UI display.
Informative feedback shall be provided for HDA query errors (e.g., data not found, timeout).",User Interface & Experience (UI/UX),"Implements the OPC Historical Access specification, supporting queries over specific time ranges. Includes data aggregation, filtering, and trend visualization tools. Query response times for a 1-day range of 100 tags should be less than 2 seconds... Error handling for HDA queries... will provide informative feedback.",,,,FALSE,high,
1991,REQ-UIX-009,Functional,"The UI shall provide a dedicated interface for monitoring and managing OPC Alarms and Conditions.
Users shall be able to view alarm details including: timestamp of occurrence, source node, event type, severity, condition name, message, acknowledged state, and timestamp of acknowledgment/return-to-normal.
The UI shall allow authorized users to acknowledge alarms.
UI alerts shall be a configurable notification mechanism for new or critical alarms.",User Interface & Experience (UI/UX),"Provides a user interface for acknowledging alarms. Alarm records will include at least: timestamp of occurrence, source node, event type, severity, condition name, message, acknowledged state, and timestamp of acknowledgment/return-to-normal. The system will support configurable notification mechanisms for alarms, such as UI alerts...",,,,FALSE,high,
1992,REQ-UIX-010,NonFunctional,"The UI shall meet defined performance targets: dashboard load times shall be less than 3 seconds (P95).
UI interaction response times for common operations (e.g., opening dialogs, submitting forms, navigating views) shall be less than 200ms (P95).",User Interface & Experience (UI/UX),UI performance targets will include dashboard load times of less than 3 seconds (P95) and UI interaction response times of less than 200ms (P95) for common operations.,,,,FALSE,high,
1993,REQ-UIX-011,Functional,"The UI shall notify users of OPC server failover events.
The UI shall provide authorized operators with controls for manual initiation of failover to a backup OPC server.
The UI shall provide authorized operators with controls for manual failback to the primary OPC server when it is restored and appropriate.",User Interface & Experience (UI/UX),Users will be notified of failover events through the UI and configurable alert mechanisms. The system will provide operators with the capability for manual failover initiation and failback to the primary server when appropriate.,,,,FALSE,medium,
1994,REQ-UIX-012,Functional,"The UI (specifically the centralized management dashboard and potentially local client UIs) shall display Key Performance Indicators (KPIs) of the OPC client application's health.
Displayed KPIs shall include OPC server connection status, message queue lengths, CPU/memory utilization of client components, and data throughput.
The UI may provide views or links to integrated monitoring tools (e.g., Kibana, Grafana) for detailed log analysis and system metrics if such integration is implemented.",User Interface & Experience (UI/UX),"Key Performance Indicators (KPIs) for client health, such as connection status to OPC servers, message queue lengths, CPU/memory utilization, and data throughput, will be tracked. ... Logs will be aggregated and analyzed using tools like the ELK Stack (Elasticsearch, Logstash, Kibana), Splunk, or cloud-native solutions...",,,,FALSE,medium,
1995,REQ-UIX-013,Functional,"The UI shall display predictions and alerts generated by the AI-driven predictive maintenance models.
The UI shall provide a feedback mechanism allowing authorized users (e.g., maintenance planners, engineers) to validate or correct these maintenance predictions.
This user feedback shall be captured by the system for potential AI model refinement.",User Interface & Experience (UI/UX),"A feedback mechanism will allow users to validate or correct maintenance predictions, which can be used for future model refinement.",,,,FALSE,medium,
1996,REQ-UIX-014,Functional,"The UI shall present detected data anomalies to authorized users (e.g., operators, process engineers).
The UI shall provide an interface for users to review details of these detected anomalies.
Users shall be able to label anomalies (e.g., true positive, false positive, specific cause) via the UI.
The UI shall allow authorized users to manage the lifecycle of detected anomalies (e.g., acknowledge, escalate, close).",User Interface & Experience (UI/UX),"A user interface will be provided for reviewing, labeling, and managing detected anomalies, facilitating model retraining and performance improvement.",,,,FALSE,medium,
